{
  "_description": "A successful deliverable: dark mode feature. 12 tasks, all completed. High conformance (0.97). Resolution latency ~45 minutes. Two apply iterations with one recovery attempt.",
  "schema_version": "0.1.0",
  "change_id": "add-dark-mode",
  "started_at": "2026-02-26T10:00:00Z",
  "completed_at": "2026-02-26T10:45:00Z",
  "status": "completed",
  "description": "Add dark mode toggle to the application settings page",
  "metrics": {
    "resolution_latency_seconds": 2700,
    "phase_durations": {
      "propose": 60,
      "specs": 120,
      "design": 180,
      "tasks": 120,
      "apply": 1800,
      "verify": 300,
      "archive": 120
    },
    "tool_calls": {
      "file_edit": 24,
      "file_read": 36,
      "bash": 15,
      "grep": 8,
      "glob": 4,
      "total": 87
    },
    "apply_iterations": 2,
    "recovery_attempts": 1,
    "tasks_completed": 12,
    "tasks_total": 12,
    "conformance": {
      "functional": 1.0,
      "correctness": 0.95,
      "constraints": 1.0,
      "iteration_penalty": 0.85,
      "overall": 0.97
    },
    "deliverable_failed": false,
    "failure_type": null
  },
  "spec_source": {
    "framework": "openspec",
    "spec_id": "changes/add-dark-mode",
    "requirements_count": 8
  },
  "agent": {
    "name": "claude-code",
    "model": "claude-sonnet-4-20250514",
    "framework": "claude-code"
  },
  "sessions": ["session-d4e5f6"]
}
